{
    "var" : {
        "a" : [ {
            "@id" : "ex:av1"
        } ],
        "d" : [ [{
            "@value" : "me1@example"
        }, {
            "@value" : "m22@example"
        } ]],
        "e" : [ {
            "@id" : "ex:ev1"
        } ],
        "ag" : [ {
            "@id" : "ex:agv1"
        } ],
        "start" : [ {
            "@value" : "2023-09-05T21:31:56.570+01:00",
            "@type" : "xsd:dateTime"
        } ],
        "end" : [ {
            "@value" : "2023-09-05T21:31:56.571+01:00",
            "@type" : "xsd:dateTime"
        } ],
        "pl" : [ {
            "@id" : "ex:pl1"
        } ],
        "e2" : [ {
            "@id" : "ex:ev2"
        } ]
    },
    "vargen" : { },
    "context" : {
        "ex" : "http://example.org/"
    },
    "template" : null
}