{
    "var": {

        "approved_pipeline": [
            {
                "@id": "file:*",
                "@type": "xsd:string",
                "@examplar": "file/approved-pipeline768",
                "@documentation": "The approved pipeline",
                "@input": "false",
                "@output": "true",
                "@sql.table": "file"
            }
        ],
        "approval_record": [
            {
                "@id": "approval:*",
                "@type": "xsd:int",
                "@examplar": "9885",
                "@documentation": "The approval record",
                "@input": "false",
                "@output": "true"}
        ],
        "pipeline": [
            {
                "@id": "file:*",
                "@type": "xsd:string",
                "@examplar": "file/pipeline368",
                "@documentation": "The pipeline before approval",
                "@input": "compulsory",
                "@output": "false",
                "@sql.table": "file"
            }
        ],
        "score": [
            {
                "@id": "score:*",
                "@type": "xsd:int",
                "@examplar": "356",
                "@documentation": "The score obtained through validation",
                "@input": "compulsory",
                "@output": "false",
                "@sql.table": "score"
            }
        ],
        "organization": [
            {
                "@id": "ag:*",
                "@type": "xsd:int",
                "@documentation": "An organization aiming managing the ML pipeline",
                "@input": "optional"
            }
        ],
        "manager": [
            {
                "@id": "ag:*",
                "@type": "xsd:int",
                "@documentation": "The manager approving the ML pipeline",
                "@input": "optional"
            }
        ],
        "approving": [
            {
                "@id": "act:*",
                "@type": "xsd:int",
                "@documentation": "The activity of approving the pipeline",
                "@output": "true",
                "@sql.table": "activity"
            }
        ],
        "signature": [
            [
                {
                    "@value": "*",
                    "@type": "xsd:string",
                    "@documentation": "The approval's signature",
                    "@input": "optional"
                }
            ]
        ],
        "path": [
            [
                {
                    "@value": "*",
                    "@type": "xsd:string",
                    "@documentation": "The actual path of the file",
                    "@input": "optional"
                }
            ]
        ],
        "time": [
            [
                {
                    "@value": "*",
                    "@type": "xsd:dateTime",
                    "@documentation": "Time when the filtered file is created",
                    "@input": "optional",
                    "@sql.type":  "timestamptz"
                }
            ]
        ],
        "start": [
            [
                {
                    "@value": "*",
                    "@type": "xsd:dateTime",
                    "@documentation": "Time when the transformation starts",
                    "@input": "optional",
                    "@sql.type":  "timestamptz"
                }
            ]
        ],
        "end": [
            [
                {
                    "@value": "*",
                    "@type": "xsd:dateTime",
                    "@documentation": "Time when the transformation ends",
                    "@input": "optional",
                    "@sql.type":  "timestamptz"
                }
            ]
        ]
    },
    "context": {
        "ag":  "${PROV_API}/live/agent/",
        "act": "${PROV_API}/live/activity/",
        "file": "${PROV_API}/live/file/",
        "approval": "${PROV_API}/live/approval/"
    },
    "template": "TODO template",
    "@documentation": "TODO doc."
}
